{
  "$schema": "http://json-schema.org/draft-07/schema#",
  "title": "CollectorNFT Deployment Configuration",
  "description": "Configuration file for deploying CollectorNFT contracts",
  "type": "object",
  "properties": {
    "genImNFTAddress": {
      "type": "string",
      "pattern": "^0x[a-fA-F0-9]{40}$",
      "description": "Address of the GenImNFT contract to connect to"
    },
    "baseMintPrice": {
      "type": "string",
      "pattern": "^[0-9]+(\\.[0-9]+)?$",
      "description": "Base mint price in ETH (e.g., '0.001')"
    },
    "options": {
      "type": "object",
      "properties": {
        "validateOnly": {
          "type": "boolean",
          "description": "Only validate configuration without deploying",
          "default": false
        },
        "dryRun": {
          "type": "boolean",
          "description": "Simulate deployment without actual execution",
          "default": false
        },
        "verify": {
          "type": "boolean",
          "description": "Verify contract on block explorer after deployment",
          "default": false
        },
        "waitConfirmations": {
          "type": "number",
          "minimum": 1,
          "maximum": 20,
          "description": "Number of confirmations to wait after deployment",
          "default": 1
        }
      },
      "additionalProperties": false
    },
    "metadata": {
      "type": "object",
      "properties": {
        "description": {
          "type": "string",
          "description": "Description of this deployment"
        },
        "version": {
          "type": "string",
          "description": "Version identifier for this deployment"
        },
        "environment": {
          "type": "string",
          "enum": ["development", "staging", "production"],
          "description": "Deployment environment"
        }
      },
      "additionalProperties": false
    }
  },
  "required": ["genImNFTAddress", "baseMintPrice"],
  "additionalProperties": false
}
